question,paraphrase_question,answer
What is Dr. CHITHRA K's past experience?,What is the professional background of Dr. CHITHRA K?,"Dr. CHITHRA K has worked as an Assistant Professor at St. Joseph Engineering College, Mangalore from May 2022, at College of Engineering, Trikaripur from July 2013 to April 2022, as a Guest Lecturer at Govt.Polytechnic College, Trikaripur, Kasargod, and as a Lecturer at PA College of Engineering, Mangalore, and Atlas Group of Institutions, Sharjah. Additionally, she has experience as a Software trainee and Database support executive at DAMAC, Dubai."
What are Dr. CHITHRA K's areas of interest?,What specialized fields does Dr. CHITHRA K focus on?,"Dr. CHITHRA K's areas of interest include Mobile Computing, Network Security, MANETS, Cryptography and Cyber Security, and Computer Graphics."
What subjects has Dr. CHITHRA K handled?,What topics has Dr. CHITHRA K covered in his teaching or research?,"Dr. CHITHRA K has handled subjects such as Programming in C language, Cryptography and Cyber security, Internetworking with TCP/IP, Computer Graphics, Cyber security, Data communication, Computer networks, Software architecture, Software Engineering, Distributed computing, Data communication and networking, Mobile computing, Data base management systems, and System software."
what is the syllabus of Computer & Communication Engineering department for the batch 2022-2026?,What are the course details for the Computer & Communication Engineering department for the 2022-2026 batch?,"the syllabus of Computer & Communication Engineering department for the batch 2022-2026 is avaliable at the college website, For more details please visit https://nmamit.nitte.edu.in/syllabus/ndu/2022-26/B.Tech._CC_2022-26.pdf"
what is the syllabus of Computer & Communication Engineering department for the batch 2023-2027?,What are the course details for the Computer & Communication Engineering department for the 2023-2027 batch?,"the syllabus of Computer & Communication Engineering department for the batch 2022-2026 is avaliable at the college website, For more details please visit https://nmamit.nitte.edu.in/syllabus/ndu/2023-27/B.Tech._CC_2022-26.pdf"
what is the syllabus of Computer & Communication Engineering department for VTU?,What are the course details for the Computer & Communication Engineering department at VTU?,"the syllabus of Computer & Communication Engineering department for the batch 2022-2026 is avaliable at the college website, For more details please visit https://nmamit.nitte.edu.in/syllabus/ccm/V-VI-CCE.pdf"
What is the email of Dr. RADHAKRISHNA?,What is the contact email for Dr. RADHAKRISHNA?,The email of Dr. RADHAKRISHNA is radhakrishna@nitte.edu.in
What is the email of Dr. ASHISH SINGH?,What is the contact email for Dr. ASHISH SINGH?,The email of Dr. ASHISH SINGH is ashishsingh@nitte.edu.in
What is the email of Dr. CHITHRA K?,What is the contact email for Dr. CHITHRA K?,The email of Dr. CHITHRA K is chithra.k@nitte.edu.in
What is the email of Mr. SHRINIVASA?,What is the contact email for Mr. SHRINIVASA?,The email of Mr. SHRINIVASA is shrinivasa.naik@nitte.edu.in
What is the email of Mr. MANJUNATHA A S?,What is the contact email for Mr. MANJUNATHA A S?,The email of Mr. MANJUNATHA A S is manjunatha.as@nitte.edu.in
What is the email of Mr. KRISHNA PRASAD D S?,What is the contact email for Mr. KRISHNA PRASAD D S?,The email of Mr. KRISHNA PRASAD D S is krishnaprasad.cc@nitte.edu.in
What is the email of Mr. SANDEEP KUMAR S?,What is the contact email for Mr. SANDEEP KUMAR S?,The email of Mr. SANDEEP KUMAR S is sandeep.kumar@nitte.edu.in
What is the email of Mr. CHIDANANDA T?,What is the contact email for Mr. CHIDANANDA T?,The email of Mr. CHIDANANDA T is chidananda.t@nitte.edu.in
What is the email of Ms. MAMATHA K M?,What is the contact email for Ms. MAMATHA K M?,The email of Ms. MAMATHA  K M is mamatha.km@nitte.edu.in
